{
  "specversion": "1.0",
  "id": "schema check",
  "source": "https://github.com/practice-library/machinery",
  "type": "org.practice-library.protocol.v0.request",
  "protocol": "0",
  "time": "2026-10-31T12:00:00Z",
  "datacontenttype": "application/json",
  "data": {
    "to": "https://github.com/practice-library/.github",
    "refs": [
      "practice-library/machinery#7"
    ],
    "needs": [
      "A metaschema mode in schema-check."
    ]
  }
}
